"ProductID","Product_Name","Product_Description","CategoryID"
GGOEAAAJ032415,ANRABESS Women's Summer 2 Piece Outfits,ANRABESS Women's Summer 2 Piece Outfits Sleeveless Tank Crop Button Back Top Capri Wide Leg Pants Linen Set with Pockets,1
GGOEAAAJ032425,Dokotoo Tops for Women Trendy Summer Casual,Dokotoo Tops for Women Trendy Summer Casual Cap Short Sleeve Basic Textured Solid Color Round Neck T Shirts Blouse,1
GGOEAAAJ032435,rendy Queen Womens Oversized Sweatshirts Turtleneck,rendy Queen Womens Oversized Sweatshirts Turtleneck Pullover Long Sleeve Hoodies Tops Fall Outfits 2023 Clothes,1
GGOEAAAJ032445,Men's Crewneck Sweatshirts Soild Color,Men's Crewneck Sweatshirts Soild Color Geometric Texture Long Sleeve Casual Pullover Shirt,1
GGOEAAAJ032455,yageyan Men Canvas Low top Shoes,yageyan Men Canvas Low top Shoes Classic Casual Sneakers Black and White Fashion Shoes,1
GGOEAFKQ020199,Mr. Pen- Sticky Notes 12 Pads,"Mr. Pen- Sticky Notes, 12 Pads, 3''x3'', Vintage Colors, Sticky Notes 3x3, Sticky Note, Sticky Pads, Sticky Notes Bulk, Stick Notes, Colored Sticky Notes, Sticky Note Pad, Colorful Sticky Notes",2
GGOEAFKQ020299,Gel Pens 12 Pcs Smooth Writing Pens No Bleed & Smear,"Gel Pens, 12 Pcs Smooth Writing Pens No Bleed & Smear, Black Ink Cute Pens Fine Point (0.5mm), Retractable Aesthetic Journaling Pens School Office Supplies for Women & Men",2
GGOEAFKQ020399,Mr. Pen File Folders 18 Pack,"Mr. Pen File Folders, 18 Pack, Morandi Colors, 1/3-Cut Tab, Letter Size, Durable Paper Folders, Office Supplies",2
GGOEAFKQ020499,Amazon Basics Stapler with 1000 Staples,"Amazon Basics Stapler with 1000 Staples, Office Stapler, 25 Sheet",2
GGOEAFKQ020599,Teal Office Supplies,"Teal Office Supplies, Teal Office Supplies and Accessories, Mint Green Stapler and Tape Dispenser Set for Women, Green Office Desk Accessories, Office Gift for Women, Office Lady, Coworkers",2
GGOEWEBB082199,OLANLY Luxury Bathroom Rug Mat 24x16,"OLANLY Luxury Bathroom Rug Mat 24x16, Extra Soft and Absorbent Microfiber Bath Rugs, Non-Slip Plush Shaggy Bath Carpet, Machine Wash Dry, Bath Mats for Bathroom Floor, Tub and Shower, Grey",3
GGOEWEBB082299,Clorox Toilet Plunger with Hideaway Storage Caddy,"Clorox Toilet Plunger with Hideaway Storage Caddy, 6.5'' x 6.5'' x 19.5'', White/Gray",3
GGOEWEBB082399,KOHLER 4636-RL-0 Cachet ReadyLatch Elongated Toilet Seat,"KOHLER 4636-RL-0 Cachet ReadyLatch Elongated Toilet Seat, Quiet-Close Lid and Seat, Countoured Seat, Grip-Tight Bumpers and Installation Hardware, White",3
GGOEWEBB082499,Rubbermaid Commercial 15 Inch Toilet Brush,"Rubbermaid Commercial 15 Inch Toilet Brush, Toilet Bowl-Cleaner for Bathroom, Scrub Brush for Toilet",3
GGOEWEBB082599,Moen YB8099CH Mason Toilet Paper Roller,"Moen YB8099CH Mason Toilet Paper Roller, Chrome",3
GGOEYDHJ056019,bubba Flo Duo Refresh Insulated Water Bottle 24 oz (TEAL),"bubba Flo Duo Refresh Insulated Water Bottle, 24 oz, TEAL (TEAL)",4
GGOEYDHJ056029,"64 oz Water Bottle","64 oz Water Bottle, 1/2 Gallon Water Bottle, Water Bottle Holder with Shoulder Strap, Time Motivational Water Bottle - Great for Camping, Gym and Outdoor Activities, Gift",4
GGOEYDHJ056039,Kids Water Bottle with Straw Lid 14oz,"Kids Water Bottle with Straw Lid 14oz, Vacuum Insulated 316 Stainless Steel Water Bottles for Kids for School, Leakproof Toddler Water Bottle, BPA Free and Keep Cold for 24 Hours",4
GGOEYDHJ056049,"64HYDRO 32oz 1Liter Motivational Water Bottle with Time Marker","64HYDRO 32oz 1Liter Motivational Water Bottle with Time Marker, Ocean Turtle Beach Summer Vibe Lose My Mind Find My Soul - TTZ2001009Z",4
GGOEYDHJ056059,Ocean Bottle 17 oz,Ocean Bottle - Recycled Stainless Steel Drinks Reusable Water Bottle - Eco-Friendly & Reusable - Sky Blue - 17 oz,4
